"가난한 삶은 간결해서 좋다. 소찬과 남루한 옷과 버성기게 놓여 있는 초라한 세간은 우리를 쓸쓸하게 하지만, 그 쓸쓸함 속에서 차라리 묵화처럼 고귀한 기품을 가진다. 정작 쓸쓸한 것은 진수성찬과 화려한 의상과 고급스러운 가구들이다. 필요 이상의 풍요는 자기 과시일 뿐이다. 자기 과시는 자신이 없는 사람의 자기 방어 기제이다. 그것은 부족감과 열등감과 불안감의 표현이다. 오페라처럼 화려한 파티는 언제나 그 끝이 시작 전보다 더욱 쓸쓸하다. 가난한 삶의 간결함은 현실 초극의 힘이 된다. 가난한 사람은 사소한 물건에도 사랑을 쏟는다. 신혼여행에 가지고 갔던 카메라도 세월이 흘러 낡으면 부자들은 그것을 버린다. 그들은 최신형의 카메라를 새로 산다. 하지만 살이 부러진 우산도 가난한 사람들에게는 지극한 사랑을 받는다. 다방이나 가게에 그것을 놓고 왔을 때 그곳이 아무리 먼 곳이더라도 가난한 사람은 그 살 부러진 우산을 찾으러 간다. 부유한 사람들은 상품을 소비하면서 살고 가난한 사람은 물건 하나하나에 정을 들이면서 산다. 가난한 사람은 늘 혼자이다. 부유한 사람들은 상품들에 둘러싸여 살 뿐 아니라 사람들에게도 둘러싸여 산다. 부자에게는 많은 사람들이 모여든다. 부잣집에는 방도 여러 개 있어야 하고 전화도 여러 대가 있어야 한다. 하지만 그가 가난해지면 사람들은 그를 떠난다. 세상에는 철새 같은 사람들이 많이 있다. 가난한 사람의 주위에는 사람이 별로 없다. 그는 몇 명 사람만 사귀면서, 그들은 진정으로 사랑하면서 산다. 가난은 사람과 사람을 더욱 강하게 결합시킨다. 가난한 사람은 늘 혼자이지만 결코 외롭지는 않다. 가난한 사람의 고독보다 부유한 사람의 고독이 더욱 공허하다. 가난한 사람의 머리는 맑다. 그의 주위에는 진정으로 사랑하는 몇 명 사람만 있고, 정 들이며 사는 꼭 필요한 물건만 있고, 의식주가 소박하기 때문이다. 가난한 사람은 물질의 횡포로부터도 자유롭고 방탕의 위험성으로부터도 자유롭다. 가난한 사람은 사치를 꿈꾸지도 못 한다. 환락의 유혹도 가난한 사람은 비켜간다. 그에게서는 취해 갈 것이 없기 때문이다. 가난한 사람은 교만해질 겨를도 없고 타락할 틈도 없다. 그러나 가난은 추억 속에서만 아름답다. 닭 모이로 쓰는 싸라기로 끼니를 이어가고, 눈이나 비를 가릴 거처는커녕 살이 부러진 우산조차 없는 것은 간결한 삶과는 거리가 멀다. 가난한 사람은 다방에 갈 수도 없고 가게에 갈 수도 없다. 그 원인이 본인의 무능력이건 사회의 구조적 모순이건 가난은 비참할 뿐이다. 정을 들일 수 있는 부숴진 세간조차 없는 사람을 두고 가난을 예찬하는 것은 사치다. 그것은 죄악이기까지 하다. 가난은 사람을 옹졸하게 만든다. 가난은 사람에게 불가능한 횡재의 꿈을 심어주고 부도덕한 판단력을 싹트게 한다. 가난은 사람을 비굴하게 만든다. 가난은 사람에게 파괴적 충동을 심어 주고 가슴속에 증오감을 싹트게 한다. 사람의 가슴속에 증오감이 뿌리내리는 것은 참으로 끔찍한 일이다. 그것은 인류의 파멸을 가져올지도 모른다. 물질적인 가난이 정신적인 가난을 이끌어내는 것은 참으로 슬픈 일이다. 그것은 물질적 풍요가 정신적인 가난을 이끌어내는 것보다 더욱 슬픈 일이다. 가난은 두 개의 얼굴을 가지고 있다. 하나는 깨끗하고 아름다운 얼굴이고 하나는 비참하고 무서운 얼굴이다. 사람은 누구나 후자보다는 전자를 선택할 것이다. 그러나 선택하기는 쉬어도 선택한 삶을 살기는 어렵다. 그것이 물질적 가난이건 물질적 풍요이건 우리의 정신이 물질의 지배에서 벗어나는 것은 얼마나 어려운 일인가. 삶의 질을 결정짓는 것은 물질이 아니라 정신이라고 말하기는 쉬워도 풍요로운 정신으로 물질을 지배하면서 살기는 어렵다."
"먹을 만큼 살게 되면 지난날의 가난을 잊어 버리는 것이 인지상정인가 보다. 가난은 결코 환영할 것이 못 되니, 빨리 잊을수록 좋은 것일지도 모른다. 그러나, 가난하고 어려웠던 생활에도 아침 이슬같이 반짝이는 아름다운 회상이 있다. 여기에 적는 세 쌍의 가난한 부부 이야기는, 이미 지나간 옛날 이야기지만, 내게 언제나 새로운 감동을 안겨다 주는 실화들이다. 그들은 가난한 신혼 부부였다. 보통의 경우라면, 남편이 직장으로 나가고 아내는 집에서 살림을 하겠지만, 그들은 반대였다. 남편은 실직으로 집 안에 있고, 아내는 집에서 가까운 어느 회사에 다니고 있었다. 어느 날 아침, 쌀이 떨어져서 아내는 아침을 굶고 출근했다. ""어떻게든지 변통을 해서 점심을 지어 놓을 테니, 그때까지만 참으오."" 출근하는 아내에게 남편은 이렇게 말했다. 마침내 점심 시간이 되어서 아내가 집에 돌아와 보니, 남편은 보이지 않고, 방안에는 신문지로 덮인 밥상이 놓여 있었다. 아내는 조용히 신문지를 걷었다. 따뜻한 밥 한 그릇과 간장 한 종지…….쌀은 어떻게 구했지만, 찬까지는 마련할 수 없었던 모양이다. 아내는 수저를 들려고 하다가 문득 상위에 놓인 쪽지를 보았다. ""왕후의 밥, 걸인의 찬……. 이걸로 우선 시장기만 속여 두오."" 낯익은 남편의 글씨였다. 순간, 아내는 눈물이 핑 돌았다. 왕후가 된 것보다도 행복했다. 만금을 주고도 살 수 없는 행복감에 가슴이 부풀었다. 다음은 어느 시인 내외의 젊은 시절 이야기다. 역시 가난한 부부였다. 어느 날 아침, 남편은 세수를 하고 들어와 아침상을 기다리고 있었다. 그 때, 시인의 아내가 쟁반에다 삶은 고구마 몇 개를 담아 들고 들어왔다. ""햇고구마가 하도 맛있다고 아랫집에서 그러기에 우리도 좀 사 왔어요. 맛이나 보셔요."" 남편은 본래 고구마를 좋아하지도 않는데다가 식전에 그런 것을 먹는 게 부담스럽게 느껴졌지만, 아내를 대접하는 뜻에서 그 중 제일 작은 놈을 하나 골라 먹었다. 그리고, 쟁반 위에 함께 놓인 홍차를 들었다. ""하나면 정이 안 간대요. 한 개만 더 드셔요."" 아내는 웃으면서 또 이렇게 권했다. 남편은 마지못해 또 한 개를 집었다. 어느 새 밖에 나갈 시간이 가까와졌다. 남편은 ""인제 나가 봐야겠소. 밥상을 들여요."" 하고 재촉했다. ""지금 잡숫고 있잖아요. 이 고구마가 오늘 우리 아침밥이어요."" ""뭐요?"" 남편은 비로소 집에 쌀이 떨어진 줄을 알고, 무안하고 미안한 생각에 얼굴이 화끈했다. ""쌀이 없으면 없다고 왜 좀 미리 말을 못 하는 거요? 사내 봉변을 시켜도 유분수지."" 뿌루퉁해서 한 마디 쏘아붙이자, 아내가 대답했다. ""저의 작은아버님이 장관이셔요. 어디를 가면 쌀 한 가마가 없겠어요?  하지만 긴긴 인생에 이런 일도 있어야 늙어서 얘깃거리가 되쟎아요."" 잔잔한 미소를 지으면서 이렇게 말하는 아내 앞에, 남편은 묵연할 수밖에 없었다. 그러면서도 가슴 속에는 형언 못 할 행복감이 밀물처럼 밀려 왔다. 다음은 어느 중로의 여인에게서 들은 이야기다. 여인이 젊었을 때였다. 남편이 거듭 사업에 실패하자, 이들 내외는 갑자기 가난 속에 빠지고 말았다. 남편은 다시 일어나 사과 장사를 시작했다. 서울에서 사과를 싣고 춘천에 갔다 넘기면 다소의 이윤이 생겼다. 그런데 한 번은, 춘천으로 떠난 남편이 이틀이 되고 사흘이 되어도 돌아오지를 않았다. 제 날로 돌아 오기는 어렵지만, 이틀째에는 틀림없이 돌아오는 남편이었다. 아내는 기다리다 못해 닷새째 되는 날 남편을 찾아 춘천으로 떠났다. ""춘천에만 닿으면 만나려니 했지요. 춘천을 손바닥만하게 알았나 봐요. 정말 막막하더군요. 하는 수 없이 여관을 뒤졌지요. 여관이란 여관은 모조리 다 뒤졌지만, 그이는 없었어요. 하룻밤을 여관에서 뜬눈으로 새웠지요. 이튿날 아침, 문득 그이의 친한 친구 한 분이 도청에 계시다는 것이 생각나서, 그분을 찾아 나섰지요. 가는 길에 혹시나 하고 정거장에 들러 봤더니……."" 매표구 앞에 늘어선 줄 속에 남편이 서 있었다. 아내는 너무 반갑고 원망스러워 말이 나오지 않았다. 트럭에다 사과를 싣고 춘천으로 떠난 남편은, 가는 길에 사람을 몇 태웠다고 했다. 그들이 사과 가마니를 깔고 앉는 바람에 사과가 상해서 제 값을 받을 수 없었다. 남편은 도저히 손해를 보아서는 안 될 처지였기에 친구의 집에 기숙을 하면서, 시장 옆에 자리를 구해 사과 소매를 시작했다. 그래서, 어젯밤 늦게서야 겨우 다 팔 수 있었다는 것이다. 전보도 옳게 제 구실을 하지 못하던 8·15 직후였으니……. 함께 춘천을 떠나 서울로 향하는 차 속에서 남편은 아내의 손을 꼭 쥐었다. 그 때만 해도 세 시간 남아 걸리던 경춘선, 남편은 한 번도 그 손을 놓지 않았다. 아내는 한 손을 맡긴 채 너무도 행복해서 그저 황홀에 잠길 뿐이었다. 그 남편은 그러나 6·25 때 죽었다고 한다. 여인은 어린 자녀들을 이끌고 모진 세파와 싸우지 않으면 안 되었다. ""이제 아이들도 다 커서 대학엘 다니고 있으니, 그이에게 조금은 면목이 선 것도 같아요. 제가 지금까지 살아 올 수 있었던 것은, 춘천서 서울까지 제 손을 놓지 않았던 그이의 손길, 그것 때문일지도 모르지요."" 여인은 조용히 웃으면서 이렇게 말을 맺었다. 지난날의 가난은 잊지 않는 게 좋겠다. 더구나 그 속에 빛나던 사랑만은 잊지 말아야겠다. ""행복은 반드시 부와 일치하진 않는다.""는 말은 결코 진부한 일 편의 경구만은 아니다."
"침묵의 숲이 잔기침을 하면서 한 꺼풀씩 깨어나고 있다. 뒤꼍 고목나무에서 먹이를 찾느라고 쪼아대는 딱따구리 소리가 자주 들리고, 산비둘기들의 구우구우거리는 소리가 서럽게 서럽게 들려오고 있다. 해마다 이맘때쯤이면 숲을 찾아오는 저 휘파람새. 할미새가 뜰에 내려와 까불까불 가벼운 몸짓으로 인사를 한다. 저 아래 골짝에서부터 안개처럼 보얗게 새 움이 터서 밀물처럼 산허리로 올라오고 있다. 머지않아 숲에는 수런수런 신록의 문이 열리리라. 그때는 나도 숲에 들어가 한 그루 정정한 나무가 되고 싶다. 나무들처럼 새 움을 틔우고 가지를 뻗으면서 연둣빛 물감을 풀어 내고 싶다. 가리워 둔 속 뜰을 꽃처럼 활짝 열어 보이고 싶다. 허허, 이 봄날이 나를 흔들려고 하네. 귀는 항시 듣던 소리를 즐거워하고 눈은 새로운 것을 보고자 한다는 말은 그럴 법하다. 음악을 듣더라도 귀에 익은 곡만을 즐겨 듣고 새 것을 찾아 눈은 구경거리의 발길을 멈추려고 하지 않는다. 그러니 귀는 좀 보수적이고 눈은 제법 진보적인 셈. 재작년이던가 여름날에 있었던 일이다. 날씨가 화창하여 밀린 빨래를 해치웠었다. 성미가 비교적 급한 나는 빨래를 하더라도 그날로 풀을 먹여 다려야지 그렇지 않으면 찜찜해서 심기가 홀가분하지 않다. 그날도 여름 옷가지를 빨아 다리고 나서 노곤해진 몸으로 마루에 누워 쉬려던 참이었다. 팔베개를 하고 누워서 서까래 끝에 열린 하늘을 무심히 바라보고 있었다. 그러다가 모로 돌아누워 산봉우리에 눈을 주었다.갑자기 산이 달리 보였다. 하, 이것 봐라 하고 나는 벌떡 일어나, 이번에는 가랑이 사이로 산을 내다보았다. 우리들이 어린 시절 동무들과 어울려 놀이를 하던 그런 모습으로. 그건 새로운 발견이었다. 하늘은 호수가 되고, 산은 호수에 잠긴 그림자가 되었다. 바로 보면 굴곡이 심한 산의 능선이 거꾸로 보니 훨씬 유장하게 보였다. 그리고 숲의 빛깔은 원색이 낱낱이 분해되어 멀고 가까움이 선명하게 드러나 얼마나 아름다운지 몰랐다. 나는 하도 신기해서 일어서서 바로 보다가 다시 거꾸로 보기를 되풀이했다. 이러한 동작을 누가 지켜보고 있었다면 필시 미친 중으로 여겼을 것이다. 그러나 여기에서 나는 새로운 사실을 캐낼 수 있었다. 우리가 일상적으로 사람을 대하거나 사물을 보고 인식하는 것은 틀에 박힌 고정관념에 지나지 않는다. 그렇기 때문에 이미 알아 버린 대상에서는 새로운 모습을 찾아내기 어렵다. 아무개 하면, 자신의 인식 속에 들어와 이미 굳어 버린 그렇고 그런 존재로밖에 볼 수가 없는 것이다. 이건 얼마나 그릇된 오해인가. 사람이나 사물은 끝없이 형성되고 변모하는 것인데. 그러나 보는 각도를 달리함으로써 그 사람이 사물이 지닌 새로운 면을, 아름다운 비밀을 찾아낼 수가 있다. 우리들이 시들하게 생각하는 그저 그렇고 그런 사이라 할지라도 선입견에서 벗어나 맑고 따뜻한 '열린 눈'으로 바라본다면 시들한 관계의 뜰에 생기가 돌 것이다. 내 눈이 열리면 그 눈으로 보는 세상도 열리는 법이니까. 인도의 신비가이며 철학자, 그리고 구루인 크리슈나무르티는 그의 저서 ""아는 것으로부터의 자유""에서 다음과 같이 말하고 있다. ""우리가 보는 법을 안다면 그때는 모든 것이 분명해질 것이다. 그리고 보는 일은 어떤 철학도, 선생도 필요로 하지 않는다. 아무도 당신에게 어떻게 볼 것인가를 가르쳐 줄 필요가 없다. 당신이 그냥 보면 된다."" 그 어떤 고정관념에도 사로잡히지 말고 허심탄회 빈 마음으로 보라는 것. 남의 눈을 빌 것 없이 자기 눈으로 볼 때 우리는 대상을 보다 정확하게 파악할 수 있을 거라는 말이다. 차를 즐기는 사람들은 흔히 이런 말을 한다. 어디서 나오는 무슨 차는 맛이 좋고, 어디 차는 맛이 시원치 않다고. 물론 기호에 따라 그렇게 말할 수도 있겠지만 차 맛에 어떤 표준이 있는 것은 아니다. 형편없는 찻감만 아니라면 한 잔의 차를 통해 삶에 대한 잔잔한 기쁨과 감사를 누릴 수 있을 것이다. 요는 그 차가 지닌 특성을 알맞게 우릴 때 바로 '그 차 맛'을 알 수 있다. 사람의 일도 마찬가지다. 인격에 고정된 어떤 틀이 있는 것은 아니다. 그 사람이 지닌 좋은 덕성을 찾아 낼 수 있다면 그는 내게 좋은 친구가 될 것이다. 한동안 나는 그 희한한 광경을 혼자서만 즐길 수 없어, 내 산거를 찾아오는 사람들에게 널리 보여 주었다. 나이 많은 노스님이건 어린 사마승이건, 신사와 숙녀를 가릴 것 없이, 나는 마치 숙달된 조교처럼 그들 앞에서 앞산을 거꾸로 내다보는 동작을 해 보였다. 그러면 그들도 천진한 어린이가 되어 거꾸로 내다보면서 좋아라 했다. 이렇다 할 구경거리가 없는 산이라 사물을 보는 또 하나의 시각을 통해 함께 즐기곤 했었다. 좀 점잖지 못한 동작이긴 하지만, 여럿이서 그런 놀이를 하고 있을 때의 광경 또한 볼 만한 것이었다. 이런 산중 아니고야 모두가 점잔만 빼는 이 세상 어디에서 그런 동작을 지을 수 있겠는가. 지난 3월 서울에 갔을 때, 가톨릭 신자인 테레사의 인도로 어떤 수도원을 찾아간 일이 있다. 수도원이라고 하면 번듯한 건물에 담장이 높고 으레 수위실이 있을 것을 연상한다. 그러나 우리가 차장간 그 수도원은 동네 끝 야산 아래 있는 조그만 초가집이었다. 경기도 고양군 중면 일산 9리 밤가시골. 학생들 가슴에 다는 명패만 한 크기의 문패. '예수의 작은 자매회'라고 빛이 바랜 나무쪽에 쓰여 있었다. 그 문패처럼 이 세상에서 아마도 가장 작은 수도원일 것이다. 마을 집을 사서 들어왔기 때문에 겉으로 보기엔 여느 민가나 다름이 없었다. 성당은 대청마루, 아무 장식도 없고 벽에 붙인 조그만 감실과 그 아래 켜져 있는 호롱불. 재래식 밥상이 하나 놓여 있었는데, 제대로 쓰이는 것인가. 프랑스에서 왔다는 수녀님 두 분과 수련 수녀까지 합해서 열 사람도 채 안 되는 조촐한 모임이었다. 마침 점심시간이 되어 주인과 나그네가 함께 한 상에 둘러앉아 구수한 냉잇국과 김치에 맛있는 공양을 했다. 처음 찾아간 나그네에게도 전혀 부담을 주지 않는 편안한 집이었다. 이곳 자매들은 마을에 일손이 바빠지면 밭에 나가 일을 거든다고 했다. 그래서 마을 사람들에게는 고맙고 가까운 이웃이 되는 모양이다. 조그마한 초가에서 항상 웃음이 넘치는 걸 보고, 수도회의 이름 그대로 '작은 자매들의 우애회'로구나 싶었다. 일신의 밤가시골 초가집 수도원에서 교회와 사원을 바라보는 '눈'을 나는 그날의 선물로 받아왔다. 가난하고 소탈하고 그러면서도 평화와 기쁨이 넘치는 자매들의 있음이, 우리에게 빛과 소금이 되었으면 싶었다."
"동해안 백암 온천에서 눈이 쌓인 주령을 넘어 내륙으로 들어서면, 산수가 빼어난 고원 지대가 펼쳐진다. 여기가 겨우내 눈이 내리는, 하늘 아래 첫 고을인 수비면으로, 대구에서 오자면 차편으로 근 다섯 시간을 달려야 하는 곳이다. 마을이라고 하지만, 여기저기 산비탈에 농가가 몇 채씩 옹기종기 모여 있는 가난한 자연 촌락이다. 이 근방에는 천혜의 절경이 많이 있다. 그리고 이 고장 사람들 자신이, 그 절경을 이루는 웅장한 산이며 기암 절벽이며 눈 덮인 수림이며 산새며 바람 소리와 함께, 없어서는 안 될 자연의 한 부분이 되어 있다. 이들의 주된 생업은 채소 농사와 담배 농사지만, 철 따라 산나물과 약초를 캐고 송이버섯을 따들이기도 한다. 이쩌면, 바보가 아니면 달관한 사람만이 살 수 있을 것 같은 첩첩 산중의 마을이다. 어느 해 봄, 이 마을에 뜻밖의 황새 한 쌍이 날아 들어왔다. 꿩이나 산비둘기가 아니면 부엉이나 매 같은 산새들만 보아 온 이 마을 사람들의 눈에는 그 황새가 신기했다. 희고 큰 날개를 여유 있게 훨훨 흔들며 노송의 위를 짝을 지어 유유히 날아 다니는 품이 정말 대견스럽다. 붉은 주둥이와 긴목, 새하얀 털로 덮인 날개 밑으로 쭉 뻗어 내린 검붉은 두다리, 황새의 자태는 과연 군자의 모습이었다.  뻐꾸기 울음소리가 빗물처럼 쏟아지는 늦은 봄의 오후, 마을 사람들은 잠시 일손을 멈추고 황새 이야기로 웃음꽃을 피웠다. 이들은 그 황새가 길조라고 믿고, 무엇인가 막연한 기대에 부풀어 있었다. 금년엔 찻길이 뚫리겠지, 올해는 꼭 전기가 들어오겠지 하고 ...... 그런데 변이 생겼다. 낙엽이 질 무렵의 어느 날 아침, 이 마을을 지나가던 밀렵군이 그 황새를 보고 총을 쏜 것이다. 총소리에 놀란 마을 사람들은 아침을 먹다 말고 황새 둥지가 있는 노송 숲으로 뛰어 모였다. 밀렵꾼은 도망을 가고, 황새 한 마리가 선지피를 흘리며 마른 억새풀 위에 쓰러져 있었다. 다른 한 마리는 어디로 날아 갔는지 보이지 않았다. 마을 사람들의 분노는 대단했다. 그 며칠 뒤였다. 밤 바람이 일기 사작했다. 지창에 갈잎이 날려와 부딪혔다. 그런데 조금은 귀에 익은 황새의 울음소리. 탁탁탁 타르르 탁탁. 사랑방에 모여 있던 마을 사람들은 가슴을 도리는 듯한 이 처절한 울음소리를 듣고 모두 말없이 마당으로 나왔다. 가을 밤, 밤 하늘에 찬란한 별들, 그 별빛에 흰 깃을 번쩍이며 황새 한 마리가 물레방앗간 주위를 이리저리 애타게 날고 있지 않은가. 총 소리에 놀라 도망갔던 황새가 돌아왔던 것이다. 그러나, 황새는 인제 인간이 두려워서, 쓰러져 누워 있는 자기의 짝한테 접근할 수가 없는 것이었다. 가슴이 뭉클해진 마을 사람들은 자리를 피해 주려고 저마다 묵묵히 집으로 돌아갔다. 그래도 황새는 연신 부리가 멍들어 부서지도록 울어댔다. 탁탁탁 타르르 탁탁 ...... 그날 밤엔 늦도록 화전민 후예들의 지붕 밑에 호롱불이 꺼지질 않았다. 며칠 뒤, 무서리가 몹시 내린 어느 날 아침, 기이하고 처참한 변이 또 일어났다. 마을 사람들이 그렇게도 알뜰히 보살펴온 그 한 쌍의 황새가 서로 목을 감고 싸늘하게 죽어 있지 않은가. 마을 사람들은 이 슬픈 광경을 보자 숙연해졌다. 그리고 저마다 무엇을 느꼈음인지 착잡한 심정으로 한참이나 말이 없었다. 황새도 영물일까? 산골의 날씨는 무섭게 추워지는데, 짝을 버리고 혼자 떠날 수 없었던 애절한 황새의 정, 조류에 따라서는 암수의 애정이 별스러운 놈도 있지만, 그것이 모두 그들의 생태요, 본능이라 했다. 그러나 하찮은 그 본능이 오늘 따라 인간의 종교보다 더 거룩하고 예술보다 더 아름답게 느껴지는 것은 무슨 까닭일까?"
