"백 사람이 앉아 즐기는 중에 혹 한 사람이 모퉁이를 향하여 한숨지으면 다들 마음이 언짢아지고, 그와 반대로 여러 사람이 침울한 얼굴을 하고 있는 사이에도 어느 한 사람의 화창한 웃음을 대하면 금시 모두 기분이 명랑해짐이 사실이다. 그러기에 '웃음'에는 '소문만복래'란 공리적인 속담이 있고, '웃는 낯에 침 못 뱉는다.'는 타산적인 잠언도 있고, 또 누구의 말인지는 잊었으나, '웃음은 인생의 꽃'이라는 자못 시적인 표어도 있다. 사람과 동물과의 구별이 언어 사용 여부에 있다고 학자들은 말하거니와, 그것보다는 차라리 '웃음의 능부에 달렸다' 함이 더 문학적이라 할까. 또한 문학이나 정치의 요는 결국 전자는 독자로 하여금 입가에 은근한 회심의 미소를 발하게 하고, 후자는 민중으로 하여금 얼굴에 명랑한 안도의 웃음을 띠게 함에 있다 하면 어떨까. '웃음'의 능력 ―― 또 그양과 질에 있어서 나는 선천적으로, 또는 여간한 수양의 덕으로 남보다 좀더 은혜를 받았음을 고맙게 생각한다. 우리 겨레가 워낙 옛날부터 하늘만 쳐다보는 낙천적인 농업 국민으로서 좋은 일에나 궂은 일에나 노상 웃음을 띠는 갸륵한 민족성을 가졌거니와, 나는 그러한 겨레의 후예로서도 특히 풍요한 웃음을 더 많이 물려받아, 내 자신 웃기를 무척 좋아하고, 또한 남이 웃는 것을 사뭇 즐기고 축복하는 자이다. 그것도 결코 '빈소'나 '조소'나 '고소'가 아닌 ―― 작으면 '미소', 크면 '가가대소', 어디까지나 '해해 · 호호' 류가 아닌 당당한 '하하 · 허허'식의 무릇 남성적인 쾌활 · 명랑한 솔직한 웃음인 것이다. 이러한 나의 '웃음'이고 보매, 결코 남에게 비웃음, 빈정웃음, 또는 부자연 · 불성실한 웃음으로 오해 혹은 간주되어 비난받을 까닭은 없다. 하기야, 극단의 독재 국가에서는 웃음의 종류 여하를 막론하고 애초부터 그것을 악의로 해석하여 형법 제 몇 조에 '웃음의 죄'를 규정할는지도 모르며, 고사를 정밀히 조사한다면 동 · 서의 폭군으로서 신하의 '무허가 웃음'을 일체 금지하여 무단히 이를 드러내어 웃는 자를 극형에 처한 예가 적지 않게 발견되리라. 말이 났으니 말이지, 내가 아는 '웃음의 죄' 로서는 독재 국가나 폭군 치하의 그것 외에 시골 천진한 색시에게도 없는 것은 아니다. 어느 민요 시인의 단시에 바로 '웃은 죄'라 제한 한 편이 있지 않은가 ――. 지름길 묻길래 / 웃고 대답하고, / 물 한 모금 달라기 웃고 떠 주었지요. 평양성에 해 안 뜬대도 / 난 몰라요, / 웃은 죄밖에."
"내가 상해에서 본 일이다. 늙은 거지 하나가 전장에 가서 떨리는 손으로 일 원짜리 은전 한 닢을 내놓으면서, ""황송하지만 이 돈이 못쓰는 것이나 아닌지 좀 보아 주십시오."" 하고 그는 마치 선고를 기다리는 죄인과 같이 전장 사람의 입을 쳐다본다. 전장 주인은 거지를 물끄러미 내려다보다가 돈을 두들겨 보고 '좋소' 하고 내어준다. 그는 '좋소' 라는 말에 기쁜 얼굴로 돈을 받아서 가슴 깊이 집어 놓고 절을 몇 번이나 하며 간다. 그는 뒤를 자꾸 돌아다보며 얼마를 가더니, 또 다른 전장을 찾아 들어갔다. 품 속에 손을 넣고 한참을 꾸물거리다가 그 은전을 내어 놓으며. ""이것이 정말 은으로 만든 돈이오니까?"" 하고 묻는다. 전장 주인도 호기심 있는 눈으로 바라다보더니, ""이 돈을 어디서 훔쳤어?"" 거지는 떨리는 목소리로, ""아닙니다. 아니예요."" ""그러면 길바닥에서 주웠다는 말이냐?"" ""누가 그렇게 큰 돈을 빠뜨립니까? 떨어지면 소리는 안 나나요? 어서 도로 주십시오."" 거지는 얼른 손을 내밀었다. 전장 사람은 웃으면서 '좋소' 하고 던져 주었다. 그는 얼른 집어서 가슴에 품고 황망히 달아난다. 뒤를 흘끔흘끔 돌아다보며 얼마를 허덕이며 달아나더니 별안간 우뚝 선다. 서서 그 은전이 빠지지나 않았나 만져보는 것이다. 거치른 손가락이 누더기 위로 그 돈을 쥘 때 그는 다시 웃는다. 그리고 또 얼마를 걸어가다가 어떤 골목 으슥한 곳으로 찾아 들어가더니, 벽돌담 밑에 쭈그리고 앉아서 돈을 손바닥에 놓고 들여다보고 있었다. 그는 얼마나 열중해 있었는지 내가 가까이 간 줄도 모르는 모양이었다. ""누가 그렇게 많이 도와 줍디까?"" 하고 나는 물었다. 그는 내 말소리에 움칠하면서 손을 가슴에 숨겼다. 그리고는 떨리는 다리로 일어서서 달아나려고 했다. ""염려 마십시오. 뺏아가지 않소."" 하고 나는 그를 안심시키려고 하였다. 한참 머뭇거리다가 그는 나를 쳐다보고 이야기를 하였다. ""이것은 훔친 것이 아닙니다. 길에서 얻은 것도 아닙니다. 누가 저 같은 놈에게 일 원 짜리를 줍니까? 각전 한 닢 받아 본 적이 없습니다. 동전 한 닢 주시는 분도 백에 한 분이 쉽지 않습니다. 나는 한 푼 한 푼 얻은 돈에서 몇 닢씩을 모았습니다. 이렇게 모은 돈 마흔 여덟 닢을 각전 닢과 바꾸었습니다. 이러기를 여섯 번을 하여 겨우 이 귀한 대양 한 푼을 갖게 되었습니다. 이 돈을 얻느라고 여섯 달이 더 걸렸습니다."" 그의 뺨에는 눈물이 흘렀다. 나는, ""왜 그렇게까지 애를 써서 그 돈을 만들었단 말이오? 그 돈으로 무엇을 하려오?"" 하고 물었다. 그는 다시 머뭇거리다가 대답했다. ""이 돈, 한 개가 갖고 싶었습니다"""
"나는 이야기를 좋아한다. 초대를 받았을 때 우선 그 주인과 거기에 나타날 손님을 미루어 보아 그 좌석에서 전개될 이야기를 상상한다. 좋은 이야기가 나올 법한 곳이면 아무리 바쁜 때라도 가고, 그렇지 않을 것 같으면 비록 성찬이 기다리고 있다 하더라도 아니 가기로 한다. 피난 시절에 음식을 따라 다니던 것은 슬픈 기억의 하나다. 나는 이야기가 하고 싶어서 추운 날 먼 길을 간 일이 있고, 밤을 새우는 것도 예사였다. 차 주전자에 물이 끓고 방이 더우면 온 세상이 어두워 손을 데이더라도 거기서 더 기쁜 일은 없었을 것이다. 눈 오는 날 다리 저는 당나귀를 타고 친구를 만나러 가는 그림이 있다. 만나서 즐거운 것은 청담이리라. 말없이 나가서 술을 받아 오는 그집 부인을 상상한들 어떠리. 지금 여성들은 대개는 첫 번 만날 때는 있는 말을 다 털어 놓는다. 남의 말을 정성껏 듣는 것도 말을 잘 하는 방법인데, 남이 말할 새 없이 자기 말만 하여서 얼마 되지 아니하는 바닥이 더 빨리 드러나는 것이다. 그리고 다음 만날 때는 예전에 한 이야기를 되풀이하기 시작한다. 아름답게 생긴 여성이 이야기를 시작한 지 삼 분이 못 되어 싫증이 나는 수가 있다. 얼굴은 그저 수수하되 말을 할 줄 아는 여인이 좋다. 내가 한 말을 멋있게 받아 넘기는 그러한 여성이라면 얼굴이 좀 빠져도 사귈 맛이 있을 것이다. 나는 거짓말을 싫어한다. 그러나 이야기를 재미있게 하기 위하여 거짓말을 약간 하는 것은 그리 나쁜 일은 아니다. 정직을 위한 정직은 필요로 하지 아니한다. 영국에서는 남에게 해를 끼치지 아니하는 거짓말을 하얀 거짓말이라고 하고, 죄있는 거짓말을 까만 거짓말이라고 한다. 이야기를 재미있게 하기 위하여 하는 거짓말은 칠색이 영롱한 무지갯빛 거짓말일 것이다. 이야기를 하노라면 자연히 남의 이야기를 하게 된다. 남의 이야기를 한다는 것은 재미있는 일이요, 이해관계 없이 남의 험담을 한다는 것은 참으로 재미있는 일이다. 이런 재미도 없이 어떻게 답답한 이 세상을 살아간단 말인가. 우리는 이야기를 하고 산다. 그리고 모든 경험은 이야기로 되어 버린다. 아무리 슬픈 현실도, 아픈 고생도, 애끓는 이별도 남에게는 한 이야기에 지나지 않을 것이다. 그리고 세월이 흐르면 당사자들에게도 한낱 이야기가 되어 버리는 것이다. 그날의 일기도, 훗날의 전기도, 치열했던 전쟁도, 유구한 역사도 다 이야기에 지나지 아니한다."
"실패란 것이 있고 성공이란 것이 있다. 어떤 것이 성공이며 어떤 것이 실패인가를 ㄱ씨는 모른다. 천 원어치 행상꾼이 만 원 밑천으로 판자 가게를 내게 된 것도 성공이요, 10억 자본의 큰 회사가 5억으로 줄어든 것도 실패라면 실패이다. 10만 원 이윤을 기대했던 장사가 5만 원 번 것은 실패라고 볼 수 있고, 5천 원을 바랐다가 만 원이 생기면 이것은 성공일 수밖에 없다. 하필 물질이나 장삿속에만 한한 것이 아니리라. 인간 일생을 통틀어 과연 어느 것이 성공이요 어느 것을 실패라고 할 것인가? 이 점에 있어서는 언제나 ㄱ씨는 회의적이다. 성공과 실패의 절대적 기준은 없다. 그러나 누구의 눈에도 뚜렷한 결정적인 실패란 것이 있다. 누구나 인정하는 불행도 있다. 이 실패, 이 불행에 인생을 아로새기는 묘미가 있다고 ㄱ씨는 생각한다.  십여 년 전 ㄱ씨는 '바둑판'을 두고 글 하나를 쓴 적이 있다. 비자나무로 다듬은 일본식 바둑판 ― 단면의 무늬가 고르고, 모든 조건에 합격한 1급품은 30년 전 값으로 2천 원, 요즘 시세로는 30~40만 원은 간다. 이 1급품 위에 또 하나 특급품이란 것이 있다. 용재며 치수며 연륜의 무늬며 어느 점에도 1급품과 다른 데가 없으나, 반면에 머리카락만한 가느다란 흉터가 보이면 이것이 '특급품'이다. 물론 값도 1급보다 10퍼센트 정도 비싸다. 오랜 세월을 두고 공들여서 기른 나무가 바둑판으로 완성될 직전에 예측하지 않은 사고로 금이 가 버리는 수가 있다. 1급품 바둑판이 목침감으로 전락할 순간이다. 그러나 그것이 최후는 아니다. 금 간 틈으로 먼지나 티가 들지 않도록 헝겊으로 고이 싸서 손이 가지 않는 곳에 간수해 둔다. 1년, 이태, 때로 3년까지 그냥 두어 둔다. 추위와 더위가 몇 차례 없이 반복되고, 습기와 건조가 여러 차례 순환한다. 그 새 상처 났던 바둑판은 제 힘으로 제 상처를 고쳐서 본디대로 유착해 버리고, 금 갔던 자리에 머리카락 같은 흔적만이 남는다. 언제나 그렇다는 것은 아니다. 한번 금 간 그 시련을 이겨내는 바둑판은 열에 하나가 어렵다. 일어로 '가야방'이라는 이 비자목 바둑판은 연하고 부드러운 탄력성이 특질이다. 한두 판만 두어도 돌자국으로 반면이 얽어 버린다. 그냥 두어 두면 하룻밤새 본디대로 다시 평평해진다. 돌을 놓을 때의 그 부드러운 감촉, '가야방'이 진중되는 것은 이 까닭이다. 한번 금이 갔다가 다시 제 힘으로 붙어진 것은 그 부드럽고 연한 특질을 증명해 보인, 이를 테면 졸업 증서이다. 하마터면 목침감이 될 뻔한 비자목 바둑판이 이래서 특급품으로 승격한다. ㄱ씨가 말하는 인생의 묘미란 이것이다. 실패나 불행은 환영할 것이 못 된다. 그러나 그것이 마지막은 아니다. 실패와 성공을 몇 차례 없이 거듭하면서, 쓴맛 단맛을 고루고루 겪어 가면서 살아가는 인생 ― 만일에 쓰러진 채 다시 일어나지 못하는 실패가 있다면 그것이야말로 막가는 실패요 불행일 수밖에 없다. 금이 간 채 제 힘으로는 아물지 않는 바둑판 맞잡이이다. 그러나  ㄱ씨는 믿고 있다. 때로는 그 불행, 그 실패로 해서 한결 더 깊어지는 인생이 있고 정화되는 사랑이 있다는 것을……. ""인간이 바둑판만도 못하다고 해서야 될 말인가?"" 옛날 쓴 ㄱ씨의 글에는 이런 끝맺음이 붙어 있다. 비자목 바둑판 이야기 행복의 기준은 어디다 두어야 할 것인가? 앞 못보는 소경은 단 한 번 빛을 보기를 원할 것이요, 다리를 못 쓰는 앉은뱅이는 제 발로 걸을 수만 있다면 ― 하는 것이 가장 절실한 소망일 것이다. ㄱ씨는 그 옛날 수인호송차에 실려서 대도회의 큰 길을 달린 적이 있었다. 호송차에서 내다보이는 길 가는 사람들의 그 행복스런 모습, 그러나 행인들에게 그 행복이 있었던 것은 아니다. 제 눈으로 빛을 볼 수 있는, 제 다리로 기을 걸을 수 있는 성한 사람들이 만일에 소경이나 앉은뱅이의 마음을 가질 수만 있다면 이 세상의 불행은 얼마나 줄어들 것인가? 자유롭게 제 발로 길 가는 행인이 호송차에 실려 가는 수인의 마음을 엿볼 수만 있다면 그들은 제 자신의 행복에 얼마나 가슴이 뛸 것인가? 온 천지에 넘쳐 흐르는 행복!  목마른 자만이 아는 물 한 그릇의 행복! ― ㄱ씨는 눈을 감고 이런 생각에 잠길 때가 있다. 행복은 마음먹기에 달려 있다.
"
"
"
"가을비가 스산히 내리는 어느 날 밤이었다. 이미 밤도 깊었는데 나는 비 속에서 우산을 받쳐들고 어느 골목길 한 모퉁이 조그마한 빈 집터 앞에서 화석처럼 혼자 서 있었다. 며칠 전까지만 해도 이 곳에는 오막살이 초가 한 채가 서 있었던 곳이다. 와보지 못한 그 새, 초가는 헐리어져 없어지고, 그 빈 집터 위에는 이제 새로 집을 세우려고 콘크리트의 기초 공사가 되어져 있었다. 사랑했던 사람의 무덤 앞에 묵연히 선 듯, 내 마음과 발걸음은 차마 이 빈 집터 앞에서 떨어지지가 않았다. 웅장미를 자랑하는 로마 시대의 고적도 아니요, 겨레의 피가 통하는 백제, 고구려나 서라벌의 유적도 아닌, 보잘 것 없는 한 칸 초옥이 헐리운 빈 터전이 이렇게도 내 마음을 아프게 울리어 주는 것은 비단 비 내리는 가을밤의 감상만은 아닌 것이다. 지난 몇 해 동안에 나는 몹시 마음이 외로울 때나, 술을 마신 밤이면 혼자서 곧잘 이 곳을 찾아 왔었던 것이다. 밖에서 밤늦게까지 술을 마시고는 통금 시간이 임박해서도 이 초가 앞을 한 번 스쳐가지 않으면 잠이 잘 오지 않는 때가 많았다. 그러면서도 나는 아직 이 초가집 주인이 무엇을 하는 사람인지, 그 가족들이 어떤 사람들인지를 잘 모르고 있다. 내가 이 초가집을 처음으로 알게 된 것은 지금으로부터 약 45년 전의 일로서, 그 때 나는 국민학교 1학년생이었다고 생각된다. 내 형제들은 3남 2녀가 되지만 모두가 그 때 중국 땅에 망명을 가서 생사를 모르던 때이다. 홀어머니는 막내아들인 나 혼자만을 데리고 남의 집 삯바느질로 겨우 연명을 해가고 있었다. 어느 날 어머님이 갑자기 병이 들어서 두 달 동안을 병석에 앓아 눕게 되었다. 추운 겨울철이었기 때문에 우리 모자는 그야말로 기한에 주리고 떨게 되었었다. 이웃 사람들이 이 딱한 꼴을 보다 못해서 나를 호떡 파는 곳에다가 취직을 시켜 주었다. 낮에는 주린 배를 움켜 잡고서 그래도 학교엘 나가고, 밤에는 호떡 상자를 메고 다니면서 밤늦게까지 호떡을 팔면 겨우 그 날의 밥벌이는 되었던 것이다. 어느 날 밤 나는 호떡 상자를 어깨 위에 메고서는 '김이 무럭무럭 나는 맛좋은 호떡 사이소. 호떡' 하고 외치면서 골목길을 지나가고 있었다. 마침 길가에 있던 조그마한 초가집 들창문이 덜커덩 열리더니 거무스레한 중년 남자의 얼굴이 불쑥 나타났다. ""호떡 5전 어치만 주가."" 중년 남자는 돈을 쥔 손을 쑥 내밀었다. 어스름 램프불이 졸고 있는 좁은 방 안에는 나보다 나이 어린 두 오누이가 있었고, 그 옆에는 어머님인 듯한 중년 부인이 바느질을 하고 있었다. 호떡 한 개 값은 1전이고, 5전 어치를 한꺼번에 사면 덤으로 한 개씩 더 끼워서 주던 때였다. 중년 남자는 호떡 여섯 개를 받아서는 오누이에게 각각 두 개씩을 나누어 주고는 나머지 두 개 중에서 한 개를 중년 부인에게 주었다. 그리고는 덜커덩 창문이 닫히고 말았다. 창문의 닫힌 방 안에서는 도란도란 정겨운 이야기 소리와 함께 네 식구들이 호떡 먹는 소리가 잔잔하게 들려왔다. 나는 어릴 때 한 번도 이러한 가족적 분위기를 맛본 일이 없었다. 일찍이 유복자로 이 세상에 태어나서 아버지의 사랑이 어떤 것인지, 또 두 형제간의 정이 어떤 것인지도 모르는 애정 실조증에 걸리어 홀어머님 밑에서 살인적인 가난과 갖은 고생을 겪으면서 자라난 나에게 이날 밤 초가집의 흐뭇한 가족적 분위기는 나에게 있어서 뼈에 사무치도록 부럽고도 그리운 광경이었다. 이 때부터 나의 머릿속에는 이 초가집 풍경이 행복하고 화목한 가정의 상징으로서 판이 박혔고, 내 몸과 마음이 외로울 때 가만히 눈을 감으면 호박꽃 같은 램프불이 피어 있는 그 창문이 머릿속에 떠오르고, 그 속에서 도란도란 정겨운 이야기 소리와 함께 호떡 씹는 소리가 잔잔히 들려오는 것이었다. 이것이 원이 되고 한이 되어, 내 형제들은 왜놈들 치하에서 모두가 가정을 버리고 놈들의 철창 속에서, 또는 이역 땅 망명의 길에서 숨져갔지마는, 나 혼자만이 비겁하게도 어떻게 하여서라도 집을 지키면서 어머님을 뫼셔 알뜰한 가정을 한 번 가져보고 죽겠다고 오늘날까지 몸부림을 쳐왔던 것이다. 그 때로부터 40여 년의 세월이 탁류로 흘러가 버린 지금, 나는 초가집보다는 몇 배나 더 큰 '콘크리트' 집을 가지게 되었고 많은 가족들을 거느리게 되었지마는, 어쩐지 아직까지도 그날 밤의 그 초가집 창가의 광경이 자꾸만 그리워지는 것은 무엇 때문일까? 근년에 사랑하는 큰 자식놈을 불의의 사고로 잃어버리고, 이따금씩 아내마저 그 거리가 무척 멀어져 가는 밤이면 나는 혼자서 술을 마시고는 곧잘 이 초가집 창가를 찾아왔던 것이다. 그러면 호박꽃 같은 램프의 불이 피어 있는 초가집 창가에서는 40여 년이 지난 지금에도 언제나 도란도란 이야기 소리와 함께 호떡을 씹는 소리가 그 방에서 잔잔히 들려 오는 것이었다. 그러나 이제는 그리운 내 동화 속의 이 초가집도 헐려져 간 데 온 데 없어졌고 스산한 가을비가 내리는 이 외로운 밤을 나는 혼자서 진정코 어디로 가야만 한단 말인가?"
"자장면은 좀 침침한 작은 중국집에서 먹어야 맛이 난다. 그 방은 퍽 좁아야 하고, 될 수 있는 대로 깨끗지 못해야 하고 칸막이에는 콩알 만한 구멍들이 몇 개 뚫려 있어야 어울린다. 식탁은 널판으로 아무렇게나 만든 앉은뱅이어야 하고, 그 위엔 담뱃불에 탄 자국들이 검고 또렷하게 무수히 산재해 있어야 정이 간다. 고춧가루 그릇은 약간의 먼지가 끼어 있는 게 좋고, 금이 갔거나 다소 깨어져 있으면 더욱 운치가 있다. 그리고 그 안에 다김 고춧가루는 누렇고 굵고 억센 것이어야 한다. 초병에도 다소 때가 끼어 있어야 가벼운 마음으로 손을 댈 수 있다.   방석도 때에 절어 윤이 날 듯하고, 손으로 잡으면 단번에 찍 하고 달라붙을 것 같은 것이어야 앉기에 편하다. 그리고 그 집 주인은 뚱뚱해야 한다. 머리엔 한 번도 기름을 바른 일이 없고, 인심 좋은 얼굴엔 개기름이 번들거리고며, 깨끗지 못한 손은 소두방만 하고, 신발은 여름이라도 털신이어야 좋다. 나는 그가 검은색의 중국 옷을 입고, 그 옷은 때에 전 것이기를 바라지만, 지금은 그런 옷을 찾기 어려우니 낡은 스웨터로 참아 두자. 어린 나를 귀여워 해 주던 내 고향의 장궤는 스웨터가 아니었는데 ……. 하여간 이런 주인에게 돈을 치르고 나오면 언제나 마음이 편안해서 좋다. 내가 어려서 최초로 대면한 중국 음식이 자장면이었고, 내가 제일 처음 가 본 내 고향의 중국집이 그런 집이었고, 이따금 흑설탕을 한 봉지씩 싸 주며 ""이거 먹어해, 헤헤헤.""하던 그 집 주인이 그런 사람이어서, 나는 자장면을 중국 음식의 전부로 알았고, 중국집이나 중국 사람은 다 그런 줄로만 알고 컸다. 스무 살 때던가, 서울에 처음 왔을 때도 나는 자장면을 잘 사 먹었는데, 그 그릇이나 맛, 그 방 안의 풍경이나 분위기는 말할 것도 없고, 비록 흑설탕은 싸 주지 않으나 그 주인의 모습까지도 내 고향의 자장면, 그 중국집, 그 장궤와 다르지 않았던 것을 기억한다. 변두리만 찾아서였을까? 해서, 내가 처음으로 으리으리한 중국집을 보았을 때, 그리고 엄청난 중국 요리 앞에 앉았을 때, 나는 그것들이 온통 가짜처럼 보였고, 겁이 났고, 괜히 왔구나 했다. 그러나 내 친애하는 자장면 장수 여러분들도 자꾸만 집을 수리하고 늘리고 새 시설을 갖추는 모양이어서, 마음 편히 갈 만한 곳이 줄어들까 걱정이다. 돈을 벌고, 빌딩을 세우고, 나보다 훌륭한 고객을 맞고 싶은 것이야 그분들의 큰 소원이겠지만, 적어도 내가 사는 동네와 내가 다니는 직장 근처에만은, 좁은데다 깨끗지 못한 중국집과 내 어리던 날의 그 장궤 같은 뚱뚱한 주인이 오래 오래 몇만 남아 있으면 한다. 세상이 아무리 변해도 ……. 그러면 나는 어느 일요일 저녁 때, 호기 있게 내 아이들을 인솔하고, 우리 동네 그 중국집으로 갈 것이다. 아이들은 입술에다 볼에다 자장을 바르고 깔깔대며 맛있게 먹을 것이고, 나는 모처럼 유능한 아비가 될 수 있을 것이다. 퇴근길에 친구를 만나면, 나는 그의 어깨를 한 팔로 얼싸안고 그 중국집으로 선뜻 들어갈 것이다. 양파 조각에 자장을 묻혀 들고 '이 사람, 어서 들어' 하며, 고량주 한 병을 맛있게 비운 다음, 좀 굳었지만 함께 자장면을 나눌 것이다. 내 친구도 세상을 좁게 겁 많게 사는 사람이니, 나를 보고 인정 잇는 친구라고 할 것이 아닌가."
